{
  "schemaVersion": 5,
  "campaign": "itc",
  "session": 4,
  "realWorldDate": "2026-01-08",
  "pcs": [
    "People/PCs/Other PCs/Into the Chasm/Finnan Oakstride.md",
    "People/PCs/Other PCs/Into the Chasm/Jrain Fanlish.md",
    "People/PCs/Other PCs/Into the Chasm/Eolo.md",
    "People/PCs/Other PCs/Into the Chasm/Ekko.md",
    "People/PCs/Other PCs/Into the Chasm/Justas Rhostrin.md"
  ],
  "sources": [
    {
      "id": "transcript-1",
      "kind": "transcript",
      "path": "_sessions/into-the-chasm/into-the-chasm-004/cleaned/into-the-chasm-004-source-cleaned.md",
      "sha256": "2ffed842f62ec04ee50288c24195e5276d7b8e40b4899fbab408fd01219855c0"
    }
  ],
  "locations": [
    "Gazetteer/Extraplanar/Shadowfolds/Zeyfa's Realm/Melusa.md",
    "Gazetteer/Extraplanar/Shadowfolds/Zeyfa's Realm/Zeyfa's Realm.md",
    "Gazetteer/Greater Sembara/Zimkova/Great Chasm.md"
  ],
  "scenes": [
    {
      "index": 1,
      "source": {
        "kind": "transcript",
        "sourceId": "transcript-1",
        "startUid": "u0027",
        "endUid": "u0227"
      },
      "type": "exploration",
      "locationDetail": "Khaled and Nura’s hut, during the rest period",
      "aiSummary": "Jrain sees Kalima leave with an unknown companion while soldiers search houses; the party chooses to finish resting.",
      "location": "Gazetteer/Extraplanar/Shadowfolds/Zeyfa's Realm/Melusa.md"
    },
    {
      "index": 2,
      "source": {
        "kind": "transcript",
        "sourceId": "transcript-1",
        "startUid": "u0228",
        "endUid": "u0509"
      },
      "type": "conversation",
      "locationDetail": "Khaled and Nura’s hut, after resting",
      "aiSummary": "Taquin speaks through baby Samir; Nura explains the remembered souls, and Finnan’s ring reveals facts about the realm.",
      "location": "Gazetteer/Extraplanar/Shadowfolds/Zeyfa's Realm/Melusa.md"
    },
    {
      "index": 3,
      "source": {
        "kind": "transcript",
        "sourceId": "transcript-1",
        "startUid": "u0510",
        "endUid": "u0642"
      },
      "type": "travel",
      "locationDetail": "Village paths and salmon pool",
      "aiSummary": "The party crosses the village toward the dissidents, observing marked doors, the portal guardian, and the salmon pool.",
      "location": "Gazetteer/Extraplanar/Shadowfolds/Zeyfa's Realm/Melusa.md"
    },
    {
      "index": 4,
      "source": {
        "kind": "transcript",
        "sourceId": "transcript-1",
        "startUid": "u0643",
        "endUid": "u1093"
      },
      "type": "conversation",
      "locationDetail": "Iskander’s hut",
      "aiSummary": "Iskander explains failed escapes and Zahara’s group, then carries a warning while the party plans to approach Malquin.",
      "location": "Gazetteer/Extraplanar/Shadowfolds/Zeyfa's Realm/Melusa.md"
    },
    {
      "index": 5,
      "source": {
        "kind": "transcript",
        "sourceId": "transcript-1",
        "startUid": "u1094",
        "endUid": "u1146"
      },
      "type": "travel",
      "locationDetail": "Former bridge landing near the salmon pool",
      "aiSummary": "The party approaches the palace landing while Eolo considers materials for his magical quiver.",
      "location": "Gazetteer/Extraplanar/Shadowfolds/Zeyfa's Realm/Melusa.md"
    },
    {
      "index": 6,
      "source": {
        "kind": "transcript",
        "sourceId": "transcript-1",
        "startUid": "u1147",
        "endUid": "u1197"
      },
      "type": "exploration",
      "locationDetail": "Metal rift and giant ice wolf",
      "aiSummary": "Eolo retrieves a dangerous metal shard for his quiver and draws the ice wolf’s attention.",
      "location": "Gazetteer/Extraplanar/Shadowfolds/Zeyfa's Realm/Melusa.md"
    },
    {
      "index": 7,
      "source": {
        "kind": "transcript",
        "sourceId": "transcript-1",
        "startUid": "u1198",
        "endUid": "u1238"
      },
      "type": "conversation",
      "locationDetail": "Bridge landing near the salmon pool",
      "aiSummary": "The group regathers and Jrain calls in Sylvan for an audience about the planar rifts.",
      "location": "Gazetteer/Extraplanar/Shadowfolds/Zeyfa's Realm/Melusa.md"
    },
    {
      "index": 8,
      "source": {
        "kind": "transcript",
        "sourceId": "transcript-1",
        "startUid": "u1239",
        "endUid": "u1263"
      },
      "type": "travel",
      "locationDetail": "Narrow ice bridge and palace entrance",
      "aiSummary": "An ice bridge extends and the party cautiously crosses to Malquin’s palace.",
      "location": "Gazetteer/Extraplanar/Shadowfolds/Zeyfa's Realm/Zeyfa's Realm.md"
    },
    {
      "index": 9,
      "source": {
        "kind": "transcript",
        "sourceId": "transcript-1",
        "startUid": "u1264",
        "endUid": "u1639"
      },
      "type": "conversation",
      "locationDetail": "Malquin’s palace audience chamber",
      "aiSummary": "Malquin’s shifting moods complicate a bargain to carry his necklace outside and return with proof of the world beyond.",
      "location": "Gazetteer/Extraplanar/Shadowfolds/Zeyfa's Realm/Zeyfa's Realm.md"
    },
    {
      "index": 10,
      "source": {
        "kind": "transcript",
        "sourceId": "transcript-1",
        "startUid": "u1640",
        "endUid": "u1734"
      },
      "type": "travel",
      "locationDetail": "Palace bridge and chasm portal",
      "aiSummary": "The ice wolf permits passage; Jrain announces their return, and the party anchors a rope before crossing the portal.",
      "location": "Gazetteer/Extraplanar/Shadowfolds/Zeyfa's Realm/Melusa.md"
    },
    {
      "index": 11,
      "source": {
        "kind": "transcript",
        "sourceId": "transcript-1",
        "startUid": "u1735",
        "endUid": "u1867"
      },
      "type": "exploration",
      "locationDetail": "Floating stone near the portal",
      "aiSummary": "Eolo moves a floating platform to rescue the others, and Finnan’s clairvoyance finds Eidrikas sustaining a damaged mechanism.",
      "time": "early to mid-afternoon",
      "location": "Gazetteer/Greater Sembara/Zimkova/Great Chasm.md",
      "dateStart": "1730-01-29",
      "dateEnd": "1730-01-29"
    },
    {
      "index": 12,
      "source": {
        "kind": "transcript",
        "sourceId": "transcript-1",
        "startUid": "u1868",
        "endUid": "u1935"
      },
      "type": "conversation",
      "locationDetail": "Lower platform with damaged mechanism",
      "aiSummary": "Ekko reunites with Eidrikas, who reports Pakrinek’s death and asks for a stolen stone piece to repair the mechanism.",
      "time": "afternoon",
      "location": "Gazetteer/Greater Sembara/Zimkova/Great Chasm.md",
      "dateStart": "1730-01-29",
      "dateEnd": "1730-01-29"
    },
    {
      "index": 13,
      "source": {
        "kind": "transcript",
        "sourceId": "transcript-1",
        "startUid": "u1936",
        "endUid": "u1994"
      },
      "type": "conversation",
      "locationDetail": "Upper floating platform",
      "aiSummary": "Ekko reports back; the party learns four outside days have passed and decides to retrieve the stolen piece before nightfall.",
      "time": "afternoon",
      "location": "Gazetteer/Greater Sembara/Zimkova/Great Chasm.md",
      "dateStart": "1730-01-29",
      "dateEnd": "1730-01-29"
    }
  ],
  "entities": [
    {
      "id": "nura",
      "kind": "npc",
      "label": "Nura",
      "aiSummary": "Nura explains the infant’s remembered soul and her fear that Samir cannot survive, then directs the party toward dissidents and other sources of knowledge.",
      "review": {
        "confidence": "high",
        "status": "automatedReviewed"
      },
      "note": "People/Zimkovans/Nura.md",
      "aiSuggestedFeaturedQuotes": [
        "nura-fate",
        "nura-change"
      ]
    },
    {
      "id": "khaled",
      "kind": "npc",
      "label": "Khaled",
      "aiSummary": "Khaled shelters the party with Nura, takes the speaking infant aside, and supports Nura during the morning conversation.",
      "review": {
        "confidence": "high",
        "status": "automatedReviewed"
      },
      "note": "People/Zimkovans/Khaled.md",
      "aiSuggestedFeaturedQuotes": [
        "khaled-baby"
      ]
    },
    {
      "id": "samir",
      "kind": "npc",
      "label": "Samir",
      "aiSummary": "The infant Samir watches the party during the night and speaks with an older soul’s voice in the morning. Nura fears that the remembered soul prevents Samir from developing independently.",
      "review": {
        "confidence": "high",
        "status": "automatedReviewed"
      },
      "note": "People/Zimkovans/Samir.md",
      "aiSuggestedFeaturedQuotes": [
        "samir-voice"
      ]
    },
    {
      "id": "taquin",
      "kind": "npc",
      "label": "Taquin",
      "aiSummary": "A soul calling itself Taquin speaks through Samir, identifies Zahara as its child, and shares a last memory of falling toward the labyrinth.",
      "review": {
        "confidence": "high",
        "status": "automatedReviewed"
      },
      "note": "People/Zimkovans/Taquin.md",
      "aiSuggestedFeaturedQuotes": [
        "taquin-memory",
        "taquin-name"
      ]
    },
    {
      "id": "kalima",
      "kind": "npc",
      "label": "Kalima",
      "aiSummary": "Jrain sees Kalima leave secretly during the rest period; Taquin identifies her companion as Zahara, and Iskander says she is hidden in the cliffside mines.",
      "review": {
        "confidence": "high",
        "status": "automatedReviewed"
      },
      "note": "People/Sembarans/Kalima.md"
    },
    {
      "id": "zahara",
      "kind": "npc",
      "label": "Zahara",
      "aiSummary": "Zahara secretly takes Kalima to safety and is described as leader of the dissidents seeking escape. The party sends a warning through Iskander without visiting Zahara’s hideout.",
      "review": {
        "confidence": "high",